{
  "$schema": "http://json-schema.org/draft-07/schema#",
  "properties": {
    "achievements": {
      "items": {
        "properties": {
          "desc": {
            "type": "string"
          },
          "hidden": {
            "type": "boolean"
          },
          "id": {
            "type": "number"
          },
          "name": {
            "type": "string"
          },
          "order": {
            "type": "number"
          },
          "reward": {
            "type": "number"
          }
        },
        "required": [
          "desc",
          "hidden",
          "id",
          "name",
          "order",
          "reward"
        ],
        "type": "object"
      },
      "type": "array"
    },
    "id": {
      "type": "string"
    },
    "name": {
      "type": "string"
    },
    "order": {
      "type": "number"
    },
    "_id": {
      "type": "number"
    }
  },
  "required": [
    "achievements",
    "id",
    "name",
    "order",
    "_id"
  ],
  "type": "object",
  "additionalProperties": false
}